{
  "schema_version": "change-passport.software-control.v1",
  "sample_id": "vllm-a69e75b-to-a85d073",
  "source_identity": {
    "brief_identity": "8fbd5a84b4ef35582e4e16e6aac679b1b2676e9de03ef536ceef9e62e7525220",
    "review_identity": "7bae6c75db43f64c92d94ae6cef65b31bff63ab8dad9223919cdd098cfdf1aaf",
    "change_identity": {
      "base_commit": "a69e75b9b6d6a26d90b6790e2eb75b3419a47c16",
      "head_commit": "a85d0738da311ce4ad5814787e61a12826e232df",
      "patch_sha256": "d9ccf142db871f6980ef53324b1d8126c069539e3c92ef8440a7c4a37058a57d"
    },
    "artifacts": [
      {
        "role": "validated_brief",
        "path": "artifacts/vllm-a69e75b-to-a85d073/brief.json",
        "sha256": "890C81F8C5C3A685208984BB3E6439F17E60DC6B5B4D111EB35D45ADA09BBED9"
      },
      {
        "role": "beginner_review",
        "path": "artifacts/vllm-a69e75b-to-a85d073/beginner-review.json",
        "sha256": "E05951CC08104093071FB6BF6BFFFFBF2437F7D695F92696F666C799AB6B2A5E"
      },
      {
        "role": "system_architecture",
        "path": "artifacts/vllm-a69e75b-to-a85d073/system-architecture.json",
        "sha256": "F741F1173EACC0B1EDB51366AAD0CB6F1E99F84CDF5C970A1A1D8D8509F4BDDB"
      },
      {
        "role": "target_profile",
        "path": "examples/target-profiles/vllm.v1.json",
        "sha256": "22F935B64D107A0CDA146B58F0304353272664A342DD396031C342196E10B41A"
      }
    ]
  },
  "product": {
    "name": "vLLM",
    "purpose": "接收程序直接调用或兼容 OpenAI 接口发来的模型请求，安排请求和计算资源运行大模型，并一次性或逐步返回结果。",
    "statement_state": "project_declared",
    "source_refs": [
      "target-profile:vllm:22f935b64d107a0cda146b58f0304353272664a342dd396031c342196e10b41a",
      "repository-readme:a85d0738da311ce4ad5814787e61a12826e232df"
    ]
  },
  "first_screen_summary": {
    "headline": "这次修复了多模态聊天可能在开头多塞一个标记的问题",
    "internal_concept_label": "离线聊天输入准备",
    "confirmed_change": {
      "text": "以前，对话模板已经放入开头标记后，文字切分处理仍可能再放一次。现在离线聊天默认不会重复添加，同时保留调用方主动覆盖这个默认值的能力。",
      "statement_state": "observed_fact",
      "state_label": "已确认",
      "state_explanation": "固定提交中的代码差异直接支持这个结论。",
      "basis": {
        "claim_ids": ["function.chat-marker-fix"],
        "evidence_ids": ["git.file.002", "git.patch"],
        "component_ids": ["prepare_input"],
        "source_refs": ["validated-brief:8fbd5a84b4ef35582e4e16e6aac679b1b2676e9de03ef536ceef9e62e7525220"]
      }
    },
    "user_impact": {
      "text": "最可能受影响的是通过离线聊天方式处理图片等多模态输入的调用方；是否改变某个具体模型的最终回答还没有实际验证。",
      "statement_state": "supported_interpretation",
      "state_label": "可能受影响",
      "state_explanation": "代码位置和修改内容指出了可能受影响的人，但真实结果仍需要运行验证。",
      "basis": {
        "claim_ids": ["function.chat-marker-fix", "architecture.input-preparation"],
        "evidence_ids": ["arch.node.001", "git.patch"],
        "component_ids": ["prepare_input"],
        "source_refs": ["limitation:static-change-is-not-runtime-result"]
      }
    },
    "residual_risk": {
      "text": "本次没有运行 vLLM、没有下载模型，也没有验证不同模型和硬件组合，因此不能把代码修复直接当成实际效果已经通过。",
      "statement_state": "unknown",
      "state_label": "还没验证",
      "state_explanation": "当前只有固定代码和静态关系证据，缺少真实运行结果。",
      "basis": {
        "claim_ids": ["attention.runtime-not-verified"],
        "evidence_ids": [],
        "component_ids": ["prepare_input", "run_model"],
        "source_refs": ["limitation:vllm-not-executed", "limitation:model-not-downloaded"]
      }
    },
    "owner_action": {
      "text": "先确认多模态聊天只保留一个开头标记，再确认普通生成方式和调用方主动设置仍保持原来的行为。",
      "statement_state": "supported_interpretation",
      "state_label": "接下来做",
      "state_explanation": "这是根据代码变化和未验证范围给出的检查建议，不代表这些检查已经完成。",
      "basis": {
        "claim_ids": ["architecture.test-coverage-added", "attention.runtime-not-verified"],
        "evidence_ids": ["arch.node.002", "git.file.001"],
        "component_ids": ["prepare_input"],
        "source_refs": ["recommendation:not-run"]
      }
    }
  },
  "five_questions": [
    {
      "id": "software_operation",
      "question": "这是个什么软件？",
      "answer": "vLLM 帮助应用高效运行大模型。请求可以由程序直接调用，也可以通过兼容 OpenAI 的接口进入；系统随后整理输入、安排请求和计算资源、运行模型，再一次性或逐步返回结果。",
      "statement_state": "project_declared",
      "state_label": "项目说明",
      "basis": {
        "claim_ids": [],
        "evidence_ids": [],
        "component_ids": ["client_request", "service_entry", "prepare_input", "queue_requests", "plan_resources", "run_model", "prepare_output", "client_response"],
        "source_refs": ["target-profile:vllm:conceptual_architecture", "repository-readme:a85d0738da311ce4ad5814787e61a12826e232df"]
      },
      "details": {
        "software_steps": [
          "让程序调用或接口请求进入 vLLM",
          "整理文字、对话和图片等模型输入",
          "安排请求先后、缓存和计算任务并运行模型",
          "整理生成结果，可一次性或边生成边返回"
        ]
      }
    },
    {
      "id": "current_change",
      "question": "AI 这次主要改变了什么？",
      "answer": "它修复了离线多模态聊天输入可能多出一个开头标记的问题。默认情况下，开头标记现在只由对话模板负责，不再让后续文字切分重复添加。",
      "statement_state": "observed_fact",
      "state_label": "已确认",
      "basis": {
        "claim_ids": ["function.chat-marker-fix", "architecture.input-preparation"],
        "evidence_ids": ["git.file.002", "git.patch", "arch.node.001"],
        "component_ids": ["prepare_input"],
        "source_refs": ["validated-brief:8fbd5a84b4ef35582e4e16e6aac679b1b2676e9de03ef536ceef9e62e7525220"]
      },
      "details": {
        "change_points": [
          "离线聊天默认不再重复添加开头标记",
          "调用方仍可明确要求添加",
          "普通生成方式的默认处理没有在实现代码中一起修改"
        ],
        "comparison_example": {
          "title": "用一次聊天输入理解",
          "before": [
            "对话模板已经加入开头标记",
            "文字切分处理又加入一次",
            "模型可能收到两个开头标记"
          ],
          "after": [
            "对话模板加入开头标记",
            "文字切分处理默认不再重复添加",
            "模型输入只保留一个开头标记"
          ]
        }
      }
    },
    {
      "id": "affected_people",
      "question": "谁会感觉到变化？",
      "answer": "最可能感觉到变化的是使用离线聊天方式处理图片等多模态内容的开发者或应用。在线聊天服务和普通生成方式目前没有发现同一处实现被修改，但这不等于所有组合都已证明不受影响。",
      "statement_state": "supported_interpretation",
      "state_label": "范围判断",
      "basis": {
        "claim_ids": ["function.chat-marker-fix", "architecture.input-preparation"],
        "evidence_ids": ["git.file.002", "arch.node.001"],
        "component_ids": ["service_entry", "prepare_input"],
        "source_refs": ["limitation:static-change-is-not-runtime-result"]
      },
      "details": {
        "audience_impacts": [
          {
            "audience": "离线多模态聊天的调用方",
            "status": "very_likely",
            "explanation": "修改直接发生在离线聊天整理输入的步骤。",
            "source_refs": ["claim:function.chat-marker-fix", "evidence:arch.node.001"]
          },
          {
            "audience": "在线聊天服务的调用方",
            "status": "not_observed",
            "explanation": "代码说明这次是在让离线默认行为与在线方式保持一致；本次没有修改在线入口。",
            "source_refs": ["evidence:git.patch"]
          },
          {
            "audience": "使用普通生成方式的人",
            "status": "not_observed",
            "explanation": "实现变化位于聊天预处理，新增测试代码还专门保留普通生成方式的原行为。",
            "source_refs": ["claim:architecture.test-coverage-added", "evidence:git.patch"]
          },
          {
            "audience": "不同模型与硬件组合",
            "status": "unknown",
            "explanation": "本次没有运行模型或硬件测试，无法确认所有组合的实际结果。",
            "source_refs": ["limitation:vllm-not-executed"]
          }
        ]
      }
    },
    {
      "id": "unknowns",
      "question": "还有什么不知道？",
      "answer": "我们还不知道新增测试在这个环境里是否通过，也不知道不同多模态模型、对话模板和硬件组合的实际输出是否都符合预期。静态分析找到的代码关联也不能证明真实请求一定经过它们。",
      "statement_state": "unknown",
      "state_label": "还没验证",
      "basis": {
        "claim_ids": ["attention.runtime-not-verified", "system.missing.history"],
        "evidence_ids": [],
        "component_ids": ["prepare_input", "run_model"],
        "source_refs": ["limitation:vllm-not-executed", "limitation:no-approved-history", "limitation:static-import-is-not-runtime"]
      },
      "details": {
        "unknowns": [
          "提交中新增的测试代码没有在本次分析中运行",
          "没有下载或运行受影响的多模态模型",
          "没有覆盖不同聊天模板、模型与硬件组合",
          "没有已批准的历史结论可供比较"
        ]
      }
    },
    {
      "id": "next_verification",
      "question": "我接下来该检查什么？",
      "answer": "先跑新增的针对性检查，确认离线多模态聊天只保留一个开头标记；再确认调用方主动覆盖默认值仍有效，并确认普通生成方式没有被连带改变。",
      "statement_state": "supported_interpretation",
      "state_label": "建议行动",
      "basis": {
        "claim_ids": ["architecture.test-coverage-added", "attention.runtime-not-verified"],
        "evidence_ids": ["git.file.001", "arch.node.002"],
        "component_ids": ["prepare_input"],
        "source_refs": ["recommendation:not-run"]
      },
      "details": {
        "owner_checks": [
          "多模态聊天默认只保留一个开头标记",
          "调用方主动要求添加时仍能覆盖默认值",
          "普通生成方式仍保持原来的输入处理"
        ],
        "actions": [
          {
            "id": "run-targeted-tests",
            "title": "运行提交中新增的针对性测试",
            "instructions": "在隔离环境安装该固定版本所需依赖，仅运行多模态聊天输入准备相关测试，记录命令、环境和真实结果。",
            "basis_type": "verified_change",
            "completion_status": "recommended_not_run",
            "source_refs": ["claim:architecture.test-coverage-added", "evidence:git.file.001"]
          },
          {
            "id": "compare-input-markers",
            "title": "比较修复前后的模型输入",
            "instructions": "使用一个会在对话模板中主动加入开头标记的多模态模型，对比修复前后实际输入标记数量。",
            "basis_type": "evidence_gap",
            "completion_status": "recommended_not_run",
            "source_refs": ["claim:function.chat-marker-fix", "limitation:vllm-not-executed"]
          },
          {
            "id": "check-unrelated-paths",
            "title": "确认没有连带改变其他入口",
            "instructions": "分别检查在线聊天方式、普通生成方式和调用方主动设置，避免把一个默认值修复扩散成其他调用方式的变化。",
            "basis_type": "project_checklist",
            "completion_status": "recommended_not_run",
            "source_refs": ["evidence:git.patch"]
          }
        ]
      }
    }
  ],
  "working_map": {
    "title": "vLLM 从请求到回答的工作图",
    "description": "先用四步理解一次模型请求，再点击任一步查看完整八步过程和技术实现。",